,Review_title,Review_text,Ratings
0,Simply awesome,It's very good to this price.....I really thankful to flipkart 😊😘.... it's very good experience with flipkart.... thank you...💙,5
1,Great product,"Seriously awwsm .. pls go for it without any hesitation.. the performance look wise so good budget friendly... Can be used for online class, online xms, browsing,and also for mid range games, basic level programming tally and all.. preferable to clg students",5
2,Fabulous!,"Performance are too good and friendly budget and also I love to buy this product very happy to this thanks Flipkart for the lovely product ❤️☺️.
I'll give 5 🌟🌟🌟🌟🌟💯",5
3,Nice product,I am happy with this laptop. Good for basic use at home. Good for kid's use also. Battery is good - runs more than 4-5 hours. Not happy with Display and no caps lock and number log indicator light.,4
4,Don't waste your money,"Its my review after used after 5 months.
Its not a valuable laptop for study or any smooth working purposes.
Issues:
1. Connectivity issues I m facing now. Specially usb port.
2. Battary performance was well for first 3 months. After it drains quickly without any playing video or audio. Only pdf reading it running hardly 2 hrs.
3. web camera is very bad performing like 0.3mp.
4. The processor also very slow and sometimes its hanging that one can't move for other work.
5. In sunlight one ...
READ MORE",1
5,Great product,I have just received the laptop today and am very excited to use it.Must say that at this price range it's one of the best laptops to buy without thinking once.Must buy if you want a decent work laptop with good specifications at this price range.,5
6,Really Nice,"it's quite good ,and one important thing to do while updating win 10 or download win 10 don't turn up your laptop it's quite risky when you download your update quickly install and restart it
and we are thinking about display quality it's good you can also play video upto 4K on youtube but first of all I think display quality is very poor cause of TFT panel but wrong TFT panel is also good but not like that IPS .

When you use it for office work then download WPS office it's good and featur...
READ MORE",4
7,Excellent for student who attend online classes.,"a god product for students, i'm writing this review after use of 1 month, if you use it only for online class and watching you tube then it's best for you & also its consumes less data if you setting in metered connection. so don't worry about data consumption.

pros- good battery back up & charging very fast, clear resolution screen and it's comes with a classy look

cons- a little bit slower, * It's takes 30-40 sec to open and after open it takes 3-5 sec to being ready to use and the ref...
READ MORE",5
8,Good choice,"It is worth laptop who like to prefer to attending online classes, watching movies, simple ms office works. It built quality was good and key board was average it is 180 degree screen rotation.when to talk about performance we can tell average and we unable to run multi apps at a time and it takes long time to restart when laptop is updated and it has average camera quality and when compare to other laptops it not have LAN support and main drawback was we don’t know if caps lock is on or off...
READ MORE",4
9,Good,"Writing this review after full 24 hours of putting this machine to grind. I bought this with a certain kind of apprehension, wondering the budget I had, the choice made after thorough research and the product chosen would cater to my needs or not? However, this piece of beauty is well equipped to go smoothly with my expectations of a big clear display, clear voice and word/pdf typing/reading works. A word of caution to the gamers though.. Don't go for this if you are into high end games. Othe...
READ MORE",3
10,Simply awesome,It's very good to this price.....I really thankful to flipkart 😊😘.... it's very good experience with flipkart.... thank you...💙,5
11,Great product,"Seriously awwsm .. pls go for it without any hesitation.. the performance look wise so good budget friendly... Can be used for online class, online xms, browsing,and also for mid range games, basic level programming tally and all.. preferable to clg students",5
12,Fabulous!,"Performance are too good and friendly budget and also I love to buy this product very happy to this thanks Flipkart for the lovely product ❤️☺️.
I'll give 5 🌟🌟🌟🌟🌟💯",5
13,Nice product,I am happy with this laptop. Good for basic use at home. Good for kid's use also. Battery is good - runs more than 4-5 hours. Not happy with Display and no caps lock and number log indicator light.,4
14,Don't waste your money,"Its my review after used after 5 months.
Its not a valuable laptop for study or any smooth working purposes.
Issues:
1. Connectivity issues I m facing now. Specially usb port.
2. Battary performance was well for first 3 months. After it drains quickly without any playing video or audio. Only pdf reading it running hardly 2 hrs.
3. web camera is very bad performing like 0.3mp.
4. The processor also very slow and sometimes its hanging that one can't move for other work.
5. In sunlight one ...
READ MORE",1
15,Great product,I have just received the laptop today and am very excited to use it.Must say that at this price range it's one of the best laptops to buy without thinking once.Must buy if you want a decent work laptop with good specifications at this price range.,5
16,Really Nice,"it's quite good ,and one important thing to do while updating win 10 or download win 10 don't turn up your laptop it's quite risky when you download your update quickly install and restart it
and we are thinking about display quality it's good you can also play video upto 4K on youtube but first of all I think display quality is very poor cause of TFT panel but wrong TFT panel is also good but not like that IPS .

When you use it for office work then download WPS office it's good and featur...
READ MORE",4
17,Excellent for student who attend online classes.,"a god product for students, i'm writing this review after use of 1 month, if you use it only for online class and watching you tube then it's best for you & also its consumes less data if you setting in metered connection. so don't worry about data consumption.

pros- good battery back up & charging very fast, clear resolution screen and it's comes with a classy look

cons- a little bit slower, * It's takes 30-40 sec to open and after open it takes 3-5 sec to being ready to use and the ref...
READ MORE",5
18,Good choice,"It is worth laptop who like to prefer to attending online classes, watching movies, simple ms office works. It built quality was good and key board was average it is 180 degree screen rotation.when to talk about performance we can tell average and we unable to run multi apps at a time and it takes long time to restart when laptop is updated and it has average camera quality and when compare to other laptops it not have LAN support and main drawback was we don’t know if caps lock is on or off...
READ MORE",4
19,Good,"Writing this review after full 24 hours of putting this machine to grind. I bought this with a certain kind of apprehension, wondering the budget I had, the choice made after thorough research and the product chosen would cater to my needs or not? However, this piece of beauty is well equipped to go smoothly with my expectations of a big clear display, clear voice and word/pdf typing/reading works. A word of caution to the gamers though.. Don't go for this if you are into high end games. Othe...
READ MORE",3
20,Awesome,"Awesome laptops I love it
Performance is very nice 1 day delivered
Really I love it Thank you for Flipkart",5
21,Waste of money!,"The webcam quality for video calls is very bad
And it takes aloot of time to open each file or folder
And the display quality is not good.
For basic kids use only .
only look wise its good
Don't buy better add little more money and buy i3/i5",1
22,Worthless,"Overall below average laptop not worth buyin nothing noteworthy pretty much not worth the money
Ps: not recommended to buy only if u can custom install and remove the stock parts",1
23,Must buy!,Best laptop in given prize range..battery was gud but processor running slow..overall laptop was good for simple works,5
24,Super!,"1. Delivery was sooo fast.... Thanks a lot for that. Seller and Ekart.

2. Design- Good and weight also perfect for carrying.

Keypad color is not adjusted as per the product color. It is very problematic to use. No capslock indicator as well as numlock indicator. All USB ports are in one side.

3. Screen - Very good. It's carefully for eye. Very soft looking. Display quality is very good.

5. Performance- Good. Little bit slow to open excel those are greater than 1mb.

6. Battery - Not good...
READ MORE",5
25,Delightful and OverAll Good.,"Very Good in Display Quality.
keyboard /Mouse Good.
Processing is something , just something slow....but its good..
Over All I found this A Great Office work Laptop , so that i want.
5 mein se phir bi 4.5 dunga..",4
26,Wonderful,Best budget laptop if you just need it for basic use and zoom meetings .. satisfied with the product .. recommended,4
27,Good choice,"overall good... value for the price ...but not for heavy works .. it's ok for basic works like web browsing, emails, office works - excell, word etc.",4
28,Excellent,"Nice product for normal & jenuine home use only , and value for money. Proud on me for good choice",5
29,Fabulous!,"Amazing product under this price range. It's stylish design, powerful processor and budget friendly is perfect for basic use. Really thankful to flipkart for delivering this amazing product on time.",5
30,Worth every penny,"It's a decent product at a price of 20000. Does the job at the price point. Dont expect it to behave like i5 or i3.
But overall good product",5
31,Fabulous!,"It's not use for heavy work .. bt ..
If u use normal work ... Exp. . office work .. during class.... Nd normal use . It's performance best in this price .. value of money... Display is also good ..
Keyboard... Average.... Battery backup good 5 hours nd depends on your work nd uses... Nd charging adaptor is so fast charging.. nd camera 📸 is also good work... Nd anyone some questions regarding laptop so .. reply me . Suggest u true.",5
32,Highly recommended,Good quality,5
33,Really Nice,Nice product should buy this if you have low budget,4
34,Highly recommended,"Best products but processor shlow..,",5
35,Delightful,Nice laptop,4
36,Nice,Product is good but battery not strong....,3
37,Awesome,Very Nice feature in low cost,5
38,Wonderful,"On an average laptop , go for it If you only want learning and doing small stuffs😊✌🏻",4
39,Perfect product!,More than expected,5
40,Great product,Very good for normal work,5
41,Decent product,"Design best but no light numeric and caps lock On off.
Performance is lower.
Betry backup Average 3-4 hour.
Display Good.",3
42,Great product,"very nice product in this price range, no hanging issue i recommend you to install asus optimizer for a incredible performance",5
43,Best in the market!,Very nice 👌 product net speed 👌 osm prosesing normal looking *****,5
44,Excellent,Its best for general use like online study.Best at this price.Thanks Flipkart,5
45,Good quality product,Good Laptop for Beginners...,4
46,Best in the market!,Very nice laptop for study and design is very good with osm performance thank u flip kart,5
47,Fair,Nice but for light use only,3
48,Don't waste your money,"Waste product, always hanging while starting the windows it's keep on hanging, packing also very worst.. Please don't buy the product by seeing the photos and features, going to return the product",1
49,Not recommended at all,Dont buy this laptop.. it stopped working within 15 days.. completely switched off.. not getting turned on..,1
50,Mind-blowing purchase,Nice laptop . I am writing this after 15 day use. Best at this price,5
51,Waste of money!,The laptop wont start when received. Flipkart has some misleading claims as now they say that replacement will be done only after Asus technician visits and checks the laptop. So one will end up wasting time and will have to deal with unnecessary haggling for no fault except buying a lemon product from Flipkart. Pathetic fine prints policy.,1
52,Delightful,Nice,4
53,Wonderful,Full laptop is very good but slow 🙂,4
54,Must buy!,Dilevery was two days delay but awesome product,5
55,Very Good,Ok,4
56,Don't waste your money,Laptop stopped responding from today (purchase date 29 Dec 2019),1
57,Wonderful,Best laptop.overall performance is awesome..myst buy,5
58,Absolute rubbish!,Don't ever buy this product trust me you will suffer later...don't buy this product,1
59,Terrible product,"One of the worst laptop ever .Review after 25 days of use. Happens daily . Very slow at performance and requires 20 mins just to start up . On start up it nearly takes 15 mins for any application to open . Hangs continuously . Asus customer service support is also bad , they keep us on hold and never returns the call . Made the worst decision ever purchasing this laptop . Have to spend more to add accessories like RAM etc .",1
60,Awesome,Good laptop,5
61,Simply awesome,"This laptop in so good and look is very wonderful.
Thanks flipkart",5
62,Just okay,The laptop is best in very cheap price,3
63,Must buy!,It was nice product in lower cost,5
64,Not good,slow,2
65,Just okay,Best at this price,3
66,Terrific purchase,"Light weight, much better than expected.
Thank you so much dear flipkart😊🙏
1st day service awsm 👍",5
67,Nice product,"Quality and Design is Super good,
But the only drawback I found after using it for 2 hours is its battery performance..
Processing is some what lagging when I have started it for first time for setting up and installing some programs.
Finally it is enough for that price range..",4
68,Does the job,Very Use ful laptop I Am Very Happy,3
69,Wonderful,Damn good 😍 lovable 😍❤️😘,5
70,Waste of money!,"Slow ....keebord not work
6math",1
71,Did not meet expectations,"7 days work okay but post returned policy laptop got hang, stopped working getting load what..kind of product are selling on your portal??worst product don't waste your money .",1
72,Mind-blowing purchase,it is a good laptop for students but not for gaming It was best expirans for me,5
73,Useless product,"Absolutely waste of money. Do not buy this laptop. It's so slow that you can literally miss whole class by the time it boots and connects. It cannot perform basic documentation even with minimal needs, you can finish 2 cups of tea by the time it is loading applications. Restarting this is absolutely headache and just keep seeing the circle in front. Sometimes it appears that there is no processor inside. Bought it for kids online class with basic functionality but my 'chintoo' threw on day on...
READ MORE",1
74,Brilliant,Its so nice,5
75,Worth the money,Good,4
76,Best in the market!,Chief &best,5
77,Does the job,"Performance not good.... display, battery are good and sound awesome 🔥I expect little more performance..offenly it not switch on, lately on...",3
78,Worth the money,Nice laptop for students. Not for heavy user.Very lite weight laptop and good in performance. Asus give a nice product.,4
79,Value-for-money,Cooling system is very good. As per price range it laptop is Good. Not for heavy task but Good laptop.,4
80,Delightful,😍😘😘😘😍Thanks flipkart &asus,4
81,Absolute rubbish!,Totally disappointed with the product. It was slow right from the first time use. It has started making some noice just after the end of return policy. But the design is really nice and the delivery was made on time.,1
82,Very poor,"Don't waste money on this product.
Its very slow.
Stop inbetween your work.
Takes long time to open file folders everything.
Even you can't take online classes properly in one go from this device its takes large time for every action.",1
83,Don't waste your money,"PRODUCT IS NOT UP TO THE MARK AS SHOWN ON THE WEBSITE , FLIPKART SAY REPLACEMENT POLICY BEWARE THEY EVEN DONT PROVIDE THE PRODUCT UPGRADATION POLICY.
VERY SLOW,
SLOW WIFI CONNECTIVITY,
HANGINNG IN SEARCHING FROM THE TASK BAR.
MAKE SURE DONT FALL FOR THE TRAP LAID BY ASUS.",1
84,Absolute rubbish!,Very very bad products don't buy this product guy's,1
85,Very poor,After 15 days not working this product,1
86,Wonderful,Osam product,4
87,Must buy!,Nice laptop Im happy,5
88,Excellent,Nice product and fast delivery from Flipkart,5
89,Good quality product,"Nyc laptop in this price design is awsm❤️
There is a small lag when we browse..",4
90,Simply awesome,Awsm product means that's too good nd it's processor is also not too slow ..... I m very happy for this I love it 🥰🥰🥰🥰,5
91,Waste of money!,"Very slow, not up to the mark....",1
92,Does the job,Average km,3
93,Perfect product!,Average,5
94,Worth every penny,Tooo good 🤟❤,5
95,Waste of money!,Booting problem add 2 3 more thousand on your budget and get good config laptop.,1
96,Just wow!,very best product,5
97,Perfect product!,Its very beautiful looking so good and stylishly leptop run is,5
98,Good quality product,"Good laptop for daily use
but not for gamer
Screen is good also speaker",4
99,Worthless,"Please don't waste your money on this. It is the worst laptop I have ever used. It takes 5 to 6 min to open simple app like microsoft edge, ms word. Etc. It is too slow can't even rely it for typing",1
100,Don't waste your money,Full hanged laptop,1
101,Wonderful,Best laptop,5
102,Delightful,It is great product in small budget 😊,4
103,"Look and fill is fine, but speed is very slow","I brought this laptop for my kids online classes, Look and fill is fine, but speed is very slow, my recommendation is don't buy this product.",2
104,Hated it!,Don't buy it. It taking longer time to switch on. And processing speed is very slow.,1
105,Waste of money!,Don't even consider this laptop just for cheaper rate. This laptop is a trap in this rate. Just after 3 day use . The laptop now don't even turns on. If by chance it turns on by mistake u can't see anything all blank .,1
106,Useless product,This is most worst laptop i ever purchased it cost me 24000 and then too battery and charging problem starts as soon as u start using it .bilieveme never bythis product,1
107,Very poor,"Very bad product
Display problem",1
108,Nice,"Good for beginners , online classes etc.",3
109,Wonderful,Good,4
110,Awesome,"Awesome laptops I love it
Performance is very nice 1 day delivered
Really I love it Thank you for Flipkart",5
111,Waste of money!,"The webcam quality for video calls is very bad
And it takes aloot of time to open each file or folder
And the display quality is not good.
For basic kids use only .
only look wise its good
Don't buy better add little more money and buy i3/i5",1
112,Worthless,"Overall below average laptop not worth buyin nothing noteworthy pretty much not worth the money
Ps: not recommended to buy only if u can custom install and remove the stock parts",1
113,Must buy!,Best laptop in given prize range..battery was gud but processor running slow..overall laptop was good for simple works,5
114,Super!,"1. Delivery was sooo fast.... Thanks a lot for that. Seller and Ekart.

2. Design- Good and weight also perfect for carrying.

Keypad color is not adjusted as per the product color. It is very problematic to use. No capslock indicator as well as numlock indicator. All USB ports are in one side.

3. Screen - Very good. It's carefully for eye. Very soft looking. Display quality is very good.

5. Performance- Good. Little bit slow to open excel those are greater than 1mb.

6. Battery - Not good...
READ MORE",5
115,Delightful and OverAll Good.,"Very Good in Display Quality.
keyboard /Mouse Good.
Processing is something , just something slow....but its good..
Over All I found this A Great Office work Laptop , so that i want.
5 mein se phir bi 4.5 dunga..",4
116,Wonderful,Best budget laptop if you just need it for basic use and zoom meetings .. satisfied with the product .. recommended,4
117,Good choice,"overall good... value for the price ...but not for heavy works .. it's ok for basic works like web browsing, emails, office works - excell, word etc.",4
118,Excellent,"Nice product for normal & jenuine home use only , and value for money. Proud on me for good choice",5
119,Fabulous!,"Amazing product under this price range. It's stylish design, powerful processor and budget friendly is perfect for basic use. Really thankful to flipkart for delivering this amazing product on time.",5
120,Excellent,Very nice Product Fully satisfied,5
121,Wonderful,Super parformans,5
122,Value-for-money,Just go for it. Very nice ❤️❤️,4
123,Terrific,Value for money it give 1 day battery backup,5
124,Excellent,"Just awesome in this price range
Looks very premium
Performance is also impressive
Just loved it",5
125,Value-for-money,Nice product,4
126,Wonderful,Very good product,4
127,Delightful,Go for it ❤️,4
128,Fabulous!,Really awesome 😄,5
129,Great product,Nice product 👍 thanks Flipkart,5
130,Excellent,Very nice Product Fully satisfied,5
131,Wonderful,Super parformans,5
132,Value-for-money,Just go for it. Very nice ❤️❤️,4
133,Terrific,Value for money it give 1 day battery backup,5
134,Excellent,"Just awesome in this price range
Looks very premium
Performance is also impressive
Just loved it",5
135,Value-for-money,Nice product,4
136,Wonderful,Very good product,4
137,Delightful,Go for it ❤️,4
138,Fabulous!,Really awesome 😄,5
139,Great product,Nice product 👍 thanks Flipkart,5
140,Must buy!,Nice laptop its is not havey this is very beautiful,5
141,Worth every penny,Good,5
142,Good choice,Nice product except for the display.,4
143,Mind-blowing purchase,Ok,5
144,Great product,Nice purchase,5
145,Good,If you really want to buy a good laptop then you have to go with vivobook 15 but if your budget is not so enough and need a of as soon as possible then you can go with....,3
146,Simply awesome,Nice performance in laptop 💻 👌 👏 👍,5
147,Nice product,Valu of maney,4
148,Value-for-money,Good only,4
149,Must buy!,Good,5
150,Excellent,Super,5
151,Classy product,Veen light weight and compact laptop. Suitable for daily light use.,5
152,Good,Update required in 5 days it is very bad product it's brightness is very low,3
153,Nice,"It's heavy
You'll experience lag if you download emulator such as BlueStacks
Leaving this two it's good",3
154,Don't waste your money,Performance very slow,1
155,Pretty good,Good,4
156,Best in the market!,Good one very nice,5
157,Simply awesome,Nice,5
158,Nice product,value for money,4
159,Delightful,Very good,4
160,Fabulous!,It was amazing 🤩🤩🤩,5
161,Waste of money!,"Battery backup is very bad
Screen size is not 14 inch
Built quality is very low",1
162,Good quality product,Good laptop in comparison to its price.,4
163,Wonderful,Easy to use and excellent in budget,4
164,Best in the market!,It's a really good laptop with very stylish looks....Value for money,5
165,Really Nice,Good,4
166,Must buy!,good,5
167,Fair,Good product,3
168,Must buy!,Nice laptop its is not havey this is very beautiful,5
169,Worth every penny,Good,5
170,Good choice,Nice product except for the display.,4
171,Mind-blowing purchase,Ok,5
172,Great product,Nice purchase,5
173,Good,If you really want to buy a good laptop then you have to go with vivobook 15 but if your budget is not so enough and need a of as soon as possible then you can go with....,3
174,Simply awesome,Nice performance in laptop 💻 👌 👏 👍,5
175,Nice product,Valu of maney,4
176,Value-for-money,Good only,4
177,Must buy!,Good,5
178,Nice product,"Writing this after using Vivobook 15 for 3 days consecutively.

Smooth and Fast
Display 10/10
•The Colors, the details and especially the eye care protection feature is a plus point I would like to give. You can work on it like more than 5hrs and its not gonna hurt your eyes trust me.
I like everything about this laptop like Premium look, Light weight, fast processor, fast charging support, expandable memory slots but the only thing which I didn't appreciate is the battery backup. Sadly it gi...
READ MORE",4
179,Good choice,"Day2
Pros
Design looks good
Performance till now for basic process is great
Fp sensor is snappy
Myasus app is good and simple.
Cons
Battery seems to be a downpoint
Camera quality ain't good
Already knew these cons.
Will update after use of 1 week.",4
180,Classy product,Very good for usage after 1 month it is good and now it will faster like new very happy with this product . quality is really awesome .😁,5
181,Moderate,"If you can affort few thousands extra you can prefer other laptops with same config.

I came to know about done limitations of this laptop
-poor webcam not even suitable for day to day online classes
-Sound very low, need to connect external speakers
-Keypad not visible due to same colour of laptop body and keys. Backlight not available.
-Low battery backup

To save cost Asus has done these compromises.

Performance wise doesn't see any issue, but since I'm using HP laptop also these small th...
READ MORE",2
182,Super!,"Design looks good
Performance till now for basic process is great, Colors, the details and especially the eye care protection feature is a plus point, Premium look, Light weight, fast processor, fast charging support. I would like to recommend this laptop for regular users..",5
183,Nice product,Well the performance is nice & have a nice UI but the only thing could have been better is it's battery. Otherwise you can go for this product blindly.,4
