,Review_title,Review_text,Ratings
2838,Just wow!,"I am writing this review based on my 10 days experience with the laptop

The first thing to be noticed is the sound, which is really low and an speaker will be required with the device. Apart from the sound quality all other features and hardware work perfectly and i am pretty happy with the product.
I really like the mode change button where user can change the mode of laptop from silent , performance or turbo depending upon the use of the device for general use or gaming.

Display-4.5/5
Bat...
READ MORE",5
2839,Worth the money,Best Configuration For The Price ... Played God Of War 🔥 Works like a charm !!,4
2840,Simply awesome,"Very good loved it
About sound all are saying low but it is good enough go to dts-x app on your laptop and try shooting mode for max volume",5
2841,Brilliant,I am using this laptop from last 1 week and it's work very fine actually i run my Android studio on it and it deployed my code very smooth value for money,5
2842,Mind-blowing purchase,The best purchase I have ever done the value of the product is extremely justify by the performance and the features we get in this laptop if you want for professional work and like editing and 3D rendering it is the go to laptop for you and if you are a gamer then definitely it's the best laptop you can buy in this price,5
2843,Really Nice,"Got this for 63k,and for the price this is a killer laptop. Although the 4800H is not as good in single core performance compared to I7 10th gen, multi-core performance is much better,multitasking, gaming,and heavy processing software are a breeze to work with the 144 refresh rate is awesome.

For now the only let down was the audio volume being too low. However I was able to download a volume booster app from ms store and that too is taken care off.

The battery is average as expected.
Displ...
READ MORE",4
2844,Awesome,Product is super......🔥🔥🔥🔥,5
2845,Super!,"Thanks Flipkart you delivered me my Asus Tuf gaming A17 Ryzen laptop timely and with full responsibility. This laptop is one of the best for Photoshop , editing and gaming purposes . If you're looking for these features in your laptop then you should definitely go for this one. I'm currently using it and it's working beyond my expectations.. you won't regret buying it.",5
2846,Brilliant,Perfect in this price range. Go for it,5
2847,Just wow!,Very good purchase 🙂,5
2848,Best in the market!,After one week of uses . I will say this is the beast for gaming,5
2849,Simply awesome,Awesome 😎👍💯,5
2850,Terrific,"I have a asus tuf gaming FX705DT which is a 4 core,compared to it the a17 is hell lot of fast in startup and all other works,the sound quality is okay than other asus gaming laptops,but doesn't matter because everybody uses external speakers . 76k is worth it , don't think just go for it",5
2851,Classy product,Great experience with this laptop,5
2852,Good choice,Awesome performance... Only minor thing I noticed that on right edge of space bar it's missing lights. I noticed same on another reviewer's pic as well. Could be design flaw..? Not sure but it doesn't concern me that much...,4
2853,Awesome,REALLY LIKE THIS PRODUCT.I LOVE IT,5
2854,Super!,"Very Happy with this❤️
Windows 11 little bit buggy hai but laptop is awesome 😌",5
2855,Mind-blowing purchase,"Good In every category according to my opinion,
You can Run any software it runs it very smoothly.
🤗 Value for money",5
2856,Great product,Performance and design is awesome but the only issue is that it's difficult to find accessories for 17.3 inch laptop. For this size laptop very limited bags are available,5
2857,Good quality product,"Speakers volume level is too low, apart from that it is good.",4
2858,Awesome,"It's real value for money , after using a months I'm giving the reviews",5
2859,Not good,"ITEM DELIVERY IS TOO LATE … It took 17 days to dispatch …. Delivery Boy has dropped badly the laptop down… Flipkart person has to take action on the fellow … They are handling goods worstly….coming to laptop Details -Battery backup is waste … Display is awesome and Autocadd rendering is the best laptop….Go for it .., After one week my wifi is not working … better to take risk … go for this laptop … waste of money ….customer care support is worst in resolve the problem ….",2
2860,Very Good,Nice purchase at 73490,4
2861,Worst experience ever!,While I working suddenly it turned off still now it's not working it doesn't show any indication lights on laptop then I am trying to contact Asus service,1
2862,Highly recommended,The laptop is amazing and has good speed. The speaker sound could have been better. The display is alrt. And the no Ms office which is a bit sad,5
2863,Terrific purchase,So far good,5
2864,Worthless,The wifi dosen't works properly. I hove to reset it every other week. Its not worth the price if you arr providing a weak wifi connection at this price point.,1
2865,Classy product,Laptop was amazing,5
2866,Wonderful,"Good performance in programming and multitasking but the battery backup is too low of about an 2 hours while using in performance wise like programming,gaming but overall it works very well.",4
2867,Good choice,As Per Not Expected But Cool To Use. I liked this product oy for easy handling but you should to go for it and grab it... 🤞,4
2868,Just wow!,Excellent product.,5
2869,Really Nice,"powerful laptop with optimum speed only drawback is speakers have low sound otherwise everything is fine
good for work and programming",4
2870,Good choice,"It's a good deal, performance is kinda okay, built quality is little compromised",4
2871,Hated it!,Display white shade,1
2872,Worthless,Very bad 👎 battery quality,1
2873,Wonderful,Everything is good but Speaker is very very very bad 😩 and compact size 👍🏼,4
2874,Excellent,In this price.. this one is suprb,5
2875,Mind-blowing purchase,Superb sleek and stylish. Fast performance,5
2876,Wonderful,"Good performance in programming and multitasking but the battery backup is too low of about an 2 hours while using in performance wise like programming,gaming but overall it works very well.",4
2877,Good choice,As Per Not Expected But Cool To Use. I liked this product oy for easy handling but you should to go for it and grab it... 🤞,4
2878,Just wow!,Excellent product.,5
2879,Really Nice,"powerful laptop with optimum speed only drawback is speakers have low sound otherwise everything is fine
good for work and programming",4
2880,Excellent,In this price.. this one is suprb,5
2881,Hated it!,Display white shade,1
2882,Good choice,"It's a good deal, performance is kinda okay, built quality is little compromised",4
2883,Worthless,Very bad 👎 battery quality,1
2884,Wonderful,Everything is good but Speaker is very very very bad 😩 and compact size 👍🏼,4
2885,Mind-blowing purchase,Superb sleek and stylish. Fast performance,5
2886,Perfect product!,"Only sound problem 📢
Not bad for gaming
But for students and official work it's very fast and excellent.",5
2887,Slightly disappointed,Battery quality is very bad and sound is very slow,2
2888,Good choice,"Poweful laptop. Speedy. Battery back up 4-6 hours if you are doing normal tasks but if you are doing heavy tasks like video editing then battery only lasts for 2-2.30 hours. Thats a little downside and sound output also. Otherwise laptop is good.
Updating drivers and windows updates will solve the problem of yellow tint.",4
2889,Did not meet expectations,Worst laptop in life speakers are worst and there is no responce of flipkart to return refund or exchange this is very bad dont buy,1
2890,Very Good,"Overall laptop is fine compact and good in performance, but sound is very low....",4
2891,Simply awesome,Bestest laptop,5
2892,Great product,"So far good experience, been a month. Good performance, ok graphics but upto 720 p games you can run.",5
2893,Good choice,"Overall it's a very good laptop for home work except it's sound quality and charging issue,
So I am not recommend you,
Better get a lower specification laptops, don't waste money to buy this laptop.",4
2894,Delightful,Battery is a big drawback here and if you are an after effects beginner you may think 16 gb without graphics card is enough but if you want to do VFX or 3d animation kina stuffs u need graphics card ❤️ !,4
2895,Worst experience ever!,Worst online shopping,1
2896,Terrific,It's a superfast and very smooth..best deal got on Bigbillion day.. Thanks Flipkart..,5
2897,Highly recommended,"Awesome laptop
Value for money 👌🏻💖
Must recommend...",5
2898,Just wow!,"Its perfectly awesome,",5
2899,Hated it!,Sound and battery is worst.. never expected this from asus,1
2900,Could be way better,"Over all performance is good , speaker quality is low and battery back up is very low",2
2901,Good quality product,"Good performance, inbuilt speakers Very bad",4
2902,Worst experience ever!,"The sound quality is very very poor, don't buy this, you can't here anything. And the battery performance is also poor.",1
2903,Good quality product,After a week I think the only drawback is the sound🔊. The volume is too low I had to use speakers everytime I need to hear any music or meeting,4
2904,Not recommended at all,Bed,1
2905,Value-for-money,"I bought it in big billion for 34k. At that price, it's totally worth it.
Battery goes beyond 2 hours if used normally. Sound is not that good, will get loud only if you are using it on a table, but most of the time I am using headphones, so sorted.
Performance wise it's awesome, matches 50k laptops.
Compact size, lightweight, no useless bezels, avg camera, avg keyboard, avg display that is not too bright, but its anti-glare, fingerprint is instant and gets my sweaty fingers.
This is not so...
READ MORE",4
2906,Must buy!,Good,5
2907,Worst experience ever!,battery backup so very very poor 😡😡 chhhiii 🤭🙄🥴,1
2908,Just wow!,Good,5
2909,Decent product,Everything is good except battery and sound. Very poor quality of sound and battery backup is worst,3
2910,Really Nice,Good,4
2911,Good choice,All good but the major drawback is its sound very low.,4
2912,Worth the money,It's very good,4
2913,Does the job,Apart from speakers everything is good,3
2914,Highly recommended,Good,5
2915,Classy product,What was described in the product is all there. I am still exploring what all I can do with it. I am satisfied with my purchase.,5
2916,Simply awesome,Value for money product. Must try,5
2917,Great product,Good,5
2918,Just wow!,I thought it was some what better before i bought but ...my thinking was totally wrong it was working in gud condition and awesome display and fastest processor,5
2919,Classy product,Good product,5
2920,Best in the market!,Awesome performance...,5
2921,Really Nice,Fine,4
2922,Yellowish Screen,"i recently bought this product in this sale but the item is received there is no damage but have software glitches like my screen have a yellow tint which i cant remove
night mode is off and still facing the yellow screen problem",3
2923,Just okay,Not good,3
2924,Horrible,Speaker quality is very bad,1
2925,Terrific purchase,Good,5
2926,Could be way better,Not too Good.sound wrost...No exchange or replacement or refund,2
2927,Worst experience ever!,Not so far,1
2928,Good quality product,"Smooth working ,Due to inbuilt of 16GB ram and ryzen 7 processor less than 10%of heat can be seen .display good ,keypad OK .Surface is nice with smooth edges",4
2929,Good,"Speakers are soo slow, consider them they don't exist. but if you want more ram in less budget you can opt this .",3
2930,Highly recommended,Good price,5
2931,Just wow!,Product is nice in low price,5
2932,Nice,"Laptop is best in this range..
Only problem is with speakers...",3
2933,Value-for-money,It is a steal laptop... I bought it for my father and he is impressed.... Just that speakers of laptop volume is low but clarity is very good,4
2934,Brilliant,Best laptop 👍👍,5
2935,Horrible,Very poor battery backup,1
2936,Delightful,I am disappointed with the sound . Sound is extremely low. If you need good sound you should go with other laptop. Otherwise overall performance is very good. Battery is also a drawback of this laptop,4
2937,Bad quality,The battery backup is very bad..... but by performance its a good lap..while browsing charge decreases fastly..dont waste your money.. dont buy this laptop..,2
2938,Awesome,"Very good product. Super value for money.
Pros-
1. Performance
2. Super configuration
3. Light weight and easy to manage

Cons- mainly only one - built quality should have been better. Feels a little plasticy and fragile.",5
2939,Bad quality,Average pc,2
2940,Must buy!,Super,5
2941,Absolute rubbish!,Sound Quality is not good,1
2942,Perfect product!,"Only sound problem 📢
Not bad for gaming
But for students and official work it's very fast and excellent.",5
2943,Slightly disappointed,Battery quality is very bad and sound is very slow,2
2944,Good choice,"Poweful laptop. Speedy. Battery back up 4-6 hours if you are doing normal tasks but if you are doing heavy tasks like video editing then battery only lasts for 2-2.30 hours. Thats a little downside and sound output also. Otherwise laptop is good.
Updating drivers and windows updates will solve the problem of yellow tint.",4
2945,Did not meet expectations,Worst laptop in life speakers are worst and there is no responce of flipkart to return refund or exchange this is very bad dont buy,1
2946,Very Good,"Overall laptop is fine compact and good in performance, but sound is very low....",4
2947,Simply awesome,Bestest laptop,5
2948,Great product,"So far good experience, been a month. Good performance, ok graphics but upto 720 p games you can run.",5
2949,Good choice,"Overall it's a very good laptop for home work except it's sound quality and charging issue,
So I am not recommend you,
Better get a lower specification laptops, don't waste money to buy this laptop.",4
2950,Delightful,Battery is a big drawback here and if you are an after effects beginner you may think 16 gb without graphics card is enough but if you want to do VFX or 3d animation kina stuffs u need graphics card ❤️ !,4
2951,Worst experience ever!,Worst online shopping,1
2952,Excellent,"One of the best student laptop under 50000 .For coding, office work and also for who love Pc game , they can also play light games like Valorant.
the processor used in this laptop(Ryzen 5500u )is one of the best processor available in this price range.",5
2953,Wonderful,"I got my laptop delivered and this is a solid one.
Ryzen 5 does all the normal work very efficiently.
It's comes preloaded with windows 11 and Ms office 2021 with lifetime validity and one good thing is that with this laptop is that,that it comes with 2 year warranty.
Overall a good experience with this.
Build quality is 👍
Speakers are decent
Display are avg not like ips but it's normal you can manage it
Overall value for money product",4
2954,Value-for-money,Very good product and awesome and perfect quality and performance is the best,4
2955,Terrific,"Damm This is a beast Laptop under 50k.
I got this laptop as low as 45k and the design, performance and battery backup is too good. I'm obsessed with backlight keyboard loved it 🤩
Pretty decent design and looks so cool 🥰",5
2956,Terrific purchase,"Awesome performance. Amd ryzen 5 and amd graphics.
Build quality is so good in this price.
Battery back up very well upto 6 - 7 hrs.
Screen quality not bed. Not ips level quality but very nice.
Without any issues.
Sound quality is pretty good. Dolby sound.
Keyboard and it's led back-lit is so cool. I like it.
And 2 years warranty. 65w fast travel adapter.
Overall this is the best laptop under RS: 50000.
This laptop suitable for office use, education purposes video or photo editing, coding, Ja...
READ MORE",5
2957,Value-for-money,"It is my first laptop it says 1.65 kg in description but it's a bit more heavy like somewhere around 2.kg build quality is good so quick and fast battery🔋 is also lasts upto 7-8 hours display is normal display would have been better if it was an ips display but ips display's consume more 🔋
Webcam is also decent just need the proper lighting for good video chats, yeah overall one thing I will say in this price range around 50k we middle class people always need to make some compromises I com...
READ MORE",4
2958,Simply awesome,Classic and elegant design !! Fast and responsive !!,5
2959,Nice product,"Every this is blazing fast
But TN display is not worth it n speakers are average better to go with asus series where you get good package overall",4
2960,Very Good,"After a week I used it you just unbelievable it's lovey
For student and office work it is really good
Backlit keyboard is awesome
And better backup is also good",4
2961,Wonderful,"overall performance was good .... build quality of the product is satisfied..
battery backup its fully depends upon your works if you are browsing it will come 8 hours..
if you are watching movie or playing games it will come only 3 hours..

full HD display was good...

sound quality just okay ...

design and other things are good

but kindly note in this laptop not having LAN port .",4
2962,Excellent,"One of the best student laptop under 50000 .For coding, office work and also for who love Pc game , they can also play light games like Valorant.
the processor used in this laptop(Ryzen 5500u )is one of the best processor available in this price range.",5
2963,Wonderful,"I got my laptop delivered and this is a solid one.
Ryzen 5 does all the normal work very efficiently.
It's comes preloaded with windows 11 and Ms office 2021 with lifetime validity and one good thing is that with this laptop is that,that it comes with 2 year warranty.
Overall a good experience with this.
Build quality is 👍
Speakers are decent
Display are avg not like ips but it's normal you can manage it
Overall value for money product",4
2964,Value-for-money,Very good product and awesome and perfect quality and performance is the best,4
2965,Terrific,"Damm This is a beast Laptop under 50k.
I got this laptop as low as 45k and the design, performance and battery backup is too good. I'm obsessed with backlight keyboard loved it 🤩
Pretty decent design and looks so cool 🥰",5
2966,Terrific purchase,"Awesome performance. Amd ryzen 5 and amd graphics.
Build quality is so good in this price.
Battery back up very well upto 6 - 7 hrs.
Screen quality not bed. Not ips level quality but very nice.
Without any issues.
Sound quality is pretty good. Dolby sound.
Keyboard and it's led back-lit is so cool. I like it.
And 2 years warranty. 65w fast travel adapter.
Overall this is the best laptop under RS: 50000.
This laptop suitable for office use, education purposes video or photo editing, coding, Ja...
READ MORE",5
2967,Value-for-money,"It is my first laptop it says 1.65 kg in description but it's a bit more heavy like somewhere around 2.kg build quality is good so quick and fast battery🔋 is also lasts upto 7-8 hours display is normal display would have been better if it was an ips display but ips display's consume more 🔋
Webcam is also decent just need the proper lighting for good video chats, yeah overall one thing I will say in this price range around 50k we middle class people always need to make some compromises I com...
READ MORE",4
2968,Simply awesome,Classic and elegant design !! Fast and responsive !!,5
2969,Nice product,"Every this is blazing fast
But TN display is not worth it n speakers are average better to go with asus series where you get good package overall",4
2970,Very Good,"After a week I used it you just unbelievable it's lovey
For student and office work it is really good
Backlit keyboard is awesome
And better backup is also good",4
2971,Wonderful,"overall performance was good .... build quality of the product is satisfied..
battery backup its fully depends upon your works if you are browsing it will come 8 hours..
if you are watching movie or playing games it will come only 3 hours..

full HD display was good...

sound quality just okay ...

design and other things are good

but kindly note in this laptop not having LAN port .",4
2972,Perfect product!,A good product to consider if u r having a budget of around 40k.. a nice look ..having good keyboard..so as typing experience with 6 hours around battery and mainly having a super performance bcoz of its processor.,5
2973,Pretty good,"Everything is awesome in case of performance and speakers , multitasking.
Pros:
It can run multi windows four heavy applications at a time .
It is very good students and multitasking.
The speakers are good and high enough to listen
Cons:
The battery backup is medium about multimedia other cases like coding and editing it gives good battery backup.
The main disadvantage is the screen it is LCD looking like not so good.
It has only 2gb amd Radeon graphics so you can't play heavy games and some...
READ MORE",4
2974,Great product,Veryy very capable laptop🔥only downside is the display bake everything is perfect.😁super satisfied😁🔥,5
2975,Super!,Good 👍,5
2976,Very Good,"Good design
Good quality
Good keypad
Good touch pad
Poor display quality with good brightness
Not a gaming laptop
Good for official work",4
2977,Worth the money,"Giving this review after using for 7days:

*Slik design
*Decent colour
*Great performance

Cons: I am little disappointed 😞 with picture quality...U can actually see the display with certain angle...",4
2978,Just wow!,"Best laptop in market in this price
Look is very attractive and good performance",5
2979,Good quality product,Nice one,4
2980,Just wow!,"Thank u Flipkart for wonderful product, just loved it",5
2981,Wonderful,"Nice laptop at 50K , good performance, but finger print is not available.",4
2982,Fabulous!,"Got this laptop last week, performance is good and light weight, easy to carry. Charger also small in size to carry easily 😁",5
2983,Excellent,👍👍👍 great product,5
2984,Fabulous!,Very nice,5
2985,Just wow!,Very nice product,5
2986,Very Good,Working good,4
2987,Terrific purchase,Best in this segment 👍,5
2988,Good,"Performance wise it is good but the edges of the laptop will start to wear out.
The screen got scratches from Day 1 itself.",3
2989,Mind-blowing purchase,"Really booting time very less, few games run good but found little heating, while play.
Normal work , perfect budget laptop.",5
2990,Just wow!,"Review after 15days use

1.performance good...
2.Battery backup is also enough about 5-6hours rough use
3. Windows 11 amazing working
4. All over good at this price
5. Build quality average

Best leptop only 2things missing

1.Finger print and
2.matalic body",5
2991,Good choice,All good but the display is very poor...if you look the display 35 degree angle it will show negetive...its very disgusting...,4
2992,Delightful,"It's worth of money
It's good for students",4
2993,Fabulous!,"Worth the price, especially with Ryzen 5. The absence of a fingerprint sensor is a minor drawback.",5
2994,Super!,"Amazing product
Every thing is always 💯 satisfied
I love ❤ it",5
2995,Fabulous!,Value for money. Good product. Thanks for flipkart,5
2996,Fabulous!,"Giving this review after 3 day of use .It comes with all the features given in the details.it is running smoothly 4-5 application together.battery backup is upto 5-6 hours while running continuesly . Display is average type negetive from downside and whitish from upper side . Sound quality is good but not so loud other mobile phones have much louder speaker then this . No heating issue after heavy use of Photoshop, AutoCAD, fl-studio and internet running for 1 hour...",5
2997,Value-for-money,"In terms of looks it's good.
Feature loaded laptop with good performance.
I feel audio quality could have been improved with better speakers",4
2998,Highly recommended,Best laptop according to me. It is value for money,5
2999,Best in the market!,Great value for Money with better quality products. Thanks so much for Flipkart as well the seller...,5
3000,Value-for-money,Except display everything good,4
3001,Very Good,Features are as expected. A good one for basic usage. But screen quality could have been better. It's very thin and need to handle it bit carefully.,4
3002,Great Laptop,Product is good but Lenovo warranty period shows only 22 months remaining,5
3003,Really Nice,"Really Best laptop for students. But it's display is fade that's way i not recommend to any who wants for editing purpose.
But overall except display laptop is best.",4
3004,Brilliant,"It was awsome.... Without any second opinion just go for it guysss....... 💗
I am in love with that device... ❤❤❤❤❤❤❤❤❤❤❤❤",5
3005,Delightful,"Performance is best in range
But display 0 star viewing angle very bad",4
3006,Really Nice,Nice,4
3007,Nice,If you want laptop with best performance then only buy this laptop... because display of this laptop is total let down...i regret buying this laptop as display quality is poor 😑.,3
3008,Classy product,Absolutely love,5
3009,Just okay,"Display quality is not good. Very dull screen.
Build quality is average.
My 8 year old HP laptop has better display and build quality.

Battery backup and processing speed is very good. I am satisfied.",3
3010,Unsatisfactory,"Suddenly the laptop hangs and it makes some buzzing noise, forced to restart, in 2 weeks time. It has happened multiple times.",1
3011,Did not meet expectations,Bettry Not a Good because Lenovo's say battery backup is 11hr but battery backup is only from 2hr to 3hr,1
3012,Brilliant,Great 👍,5
3013,Must buy!,"Ryzen u series processors reduce the RAM available for usage due to usage by graphics chip. Out of 8 gb, barely 4gb is available, rest is used by the system",5
